{
  "title": "피타고라스1",
  "grade": "중등1-1",
  "artist": "인재의창",
  "audioFile": "피타고라스1.mp3",
  "slides": [
    { "time": 0, "text": "피타고라스의 정리를 배워보자!", "emoji": "📐" },
    { "time": 4, "text": "직각삼각형의 비밀!", "emoji": "🔺" },
    { "time": 8, "text": "빗변의 제곱은", "emoji": "✨" },
    { "time": 11, "text": "나머지 두 변의 제곱의 합!", "emoji": "➕" },
    {
      "time": 15,
      "text": "C 제곱 = A 제곱 + B 제곱!",
      "emoji": "📌",
      "mathLatex": "c^2 = a^2 + b^2"
    },
    { "time": 22, "text": "직각을 마주보는 변이 빗변!", "emoji": "👁️" },
    { "time": 27, "text": "가장 긴 변이 바로 C!", "emoji": "📏" },
    { "time": 32, "text": "피타고라스! 피타고라스!", "emoji": "🏁" }
  ]
}
